{"allowedActions":["ci_repair","commit","conditional_merge","pr_update","push","ready_for_review"],"authorizationDigest":"fd8fff4ead218ad2803f76aa9be82567a5eaf9d6c3289e821ee24b9656936878","authorizationId":"65bc005b98052930d6b821459408a28f75117973859ba1c5b48e54d4912366f4","baseBranch":"main","baseSha":"3133e35df8dd520e2976116e6468761eef6d84df","decisionRef":"2026-08-23-user-r4-authorization","materialDigest":"ade89e84fe1e538d35f99c38e820099990822919e8bb3824316e25dd3edd9ddc","mode":"implement_and_merge_on_acceptance","planVersion":1,"recordedAt":"2026-08-23T03:10:12Z","repository":"github.com/KNaiFen/gkd","schemaVersion":1,"taskBranch":"task/r4-release-policy-binding","taskId":"GKD-R4"}
