{"allowedActions":["ci_repair","commit","conditional_merge","pr_update","push","ready_for_review"],"authorizationDigest":"74e00ac9221e55ecc979562787c22e2385d27d35e1c58c7867d5b22de0b44302","authorizationId":"3a0f5510beba913c19e443a0d8c7164c26f3d7375b68ea699d7ea895ad1f925d","baseBranch":"main","baseSha":"2b8cdf0cbc4055422323db76d1399112a606f058","decisionRef":"decision-gkd-gate-repair-r5","materialDigest":"ca84111a2ee3fbb8395defe629a6276ac4dea32f79860c93e14dd11b038d5e3a","mode":"implement_and_merge_on_acceptance","planVersion":1,"recordedAt":"2026-08-29T12:13:47Z","repository":"github.com/KNaiFen/gkd","schemaVersion":1,"taskBranch":"task/gkd-gate-repair-r5","taskId":"GKD-GATE-REPAIR-R5"}
