{"allowedActions":["ci_repair","commit","conditional_merge","pr_update","push","ready_for_review"],"authorizationDigest":"9d0cf6061c84139359dee136cd41c42814dacc87b6e65a63f0c94418376150e2","authorizationId":"d8c9b50fda7d09b2bb14727fa8ab9385c710d0c4192fd01b7030a91957ee2369","baseBranch":"main","baseSha":"f13258a0a1eaab1634b397f302dc17e382d0dcf1","decisionRef":"user-authorized-gkd-core-plan","materialDigest":"e3eaa8eef3d615ef1c34216400a39d2d00d99b11d5d3cebe83b6ec6e03d0ca5b","mode":"implement_and_merge_on_acceptance","planVersion":1,"recordedAt":"2026-09-01T09:34:02Z","repository":"github.com/KNaiFen/gkd","schemaVersion":1,"taskBranch":"task/gkd-p5-bundle-stage-convergence","taskId":"GKD-P5-BUNDLE-STAGE-CONVERGENCE"}
