{"allowedActions":["ci_repair","commit","conditional_merge","pr_update","push","ready_for_review"],"authorizationDigest":"4ef8c5a4eba02acf521d4ab8192be425dd71988248a8e6c12ffbca51ccaa4550","authorizationId":"e3f56c2e866a038feeed3a07647144f6280b1a2722132fcac655d898c6d46d9c","baseBranch":"main","baseSha":"790d592d63c7c34a0047f136e18fa15238e722d6","decisionRef":"gkd-r10-release-2026-08-24","materialDigest":"b52f4a488b5119276ba97e381305c6d9271fcd3b4d85230bbaac9858f0218fcc","mode":"implement_and_merge_on_acceptance","planVersion":1,"recordedAt":"2026-08-24T03:44:07Z","repository":"github.com/KNaiFen/gkd","schemaVersion":1,"taskBranch":"task/gkd-r10-github-acceptance-release","taskId":"gkd-r10-github-acceptance-release"}
