{"allowedActions":["ci_repair","commit","conditional_merge","pr_update","push","ready_for_review"],"authorizationDigest":"02e9f2abeed66f56097e535452abfe42b33246fcef1a85a2e3357e42cdcfa918","authorizationId":"ddc0667f31c9959e50c365d5518d8b6c4a0b4b6a89349c21b8b383476f4bb7b0","baseBranch":"main","baseSha":"4c5be63aedb724de01103dd63d34bec3aea74944","decisionRef":"gkd-r9-acceptance-2026-08-24","materialDigest":"9fe0b4a33aaecb5e366d4fcd93fcd3165afd6315b319acfae33e4c8d5f5b0cce","mode":"implement_and_merge_on_acceptance","planVersion":1,"recordedAt":"2026-08-24T02:28:09Z","repository":"github.com/KNaiFen/gkd","schemaVersion":1,"taskBranch":"task/gkd-r9-acceptance-adapter-repair","taskId":"gkd-r9-acceptance-adapter-repair"}
