{"allowedActions":["ci_repair","commit","conditional_merge","pr_update","push","ready_for_review"],"authorizationDigest":"84c49f24fb01edbfd9bb11f3a8f9fdea7547d39a8e364ecf7dce88380d3f80fa","authorizationId":"c090fd97092f6c57cd4a695d1d983e905ab2576026a2da57fe97cc0e7c5f3439","baseBranch":"main","baseSha":"302f60d96c2f81e85052025f814593015a436bd7","decisionRef":"user-2026-08-20-proceed-roadmap","materialDigest":"59a4e08b5209c324f10feeee258ddae4fb2a273647f4f5ea60b1d27cf1c4c395","mode":"implement_and_merge_on_acceptance","planVersion":1,"recordedAt":"2026-08-19T18:53:30Z","repository":"github.com/KNaiFen/gkd","schemaVersion":1,"taskBranch":"task/m2-automatic-runtime-bridge","taskId":"GKD-M2-C"}
