{"allowedActions":["ci_repair","commit","conditional_merge","pr_update","push","ready_for_review"],"authorizationDigest":"426753f66072b7cddde8aa2263a2513b4f1c8913b2898ae7e5d59eb32eae9ce6","authorizationId":"315308b47aef080b410da735fa9e2cf9b71f3f1db5ec1cb1f2452095c2dcf39e","baseBranch":"main","baseSha":"d093113f2252a322956cc4f9dae2067be51d33a2","decisionRef":"user-authorization-2026-08-23-consumer-bootstrap-repair","materialDigest":"e1cd26a399b8ae463577cb405857977f90f93f894133892cc5b10bd71453cc71","mode":"implement_and_merge_on_acceptance","planVersion":1,"recordedAt":"2026-08-22T16:35:17Z","repository":"github.com/KNaiFen/gkd","schemaVersion":1,"taskBranch":"task/gkd-p3-consumer-bootstrap-policy","taskId":"gkd-p3-consumer-bootstrap-policy"}
