{"allowedActions":["ci_repair","commit","conditional_merge","pr_update","push","ready_for_review"],"authorizationDigest":"0cf4475320312bc921902b40779882e38d9676133175c75d972792a5e065d6dd","authorizationId":"0ca95baa14c37b6e2fbde4ad14d2711a891662e3eeee0e49b8fc650bb01c412d","baseBranch":"main","baseSha":"5708aaf990564b07c258bdc34682249df1b5b5f6","decisionRef":"gkd_core_implementation","materialDigest":"7257d27fb2da0c8f6decd568bc86b07e2c36e3036f212398247cdc4b20147a9f","mode":"implement_and_merge_on_acceptance","planVersion":1,"recordedAt":"2026-08-30T04:35:16Z","repository":"github.com/KNaiFen/gkd","schemaVersion":1,"taskBranch":"task/gkd-o4-lane-manifest-compat-r3","taskId":"GKD-O4-LANE-MANIFEST-COMPAT-R3"}
