{"allowedActions":["ci_repair","commit","conditional_merge","pr_update","push","ready_for_review"],"authorizationDigest":"e194c2516691fdf7dc8bb4695a96d9a545c40d6316a330c581de756901ee1ab5","authorizationId":"de2c422b22e407d4f560bf709881a7829ece8cd411e36eb18ea55c4c66d9a1e7","baseBranch":"main","baseSha":"5605c5fb16d0571185aeab256cf4c4c40a52061c","decisionRef":"user-authorization-2026-08-31-input-reduction","materialDigest":"4a0fb35a7b1ff19777eb148b70c14346817744d5fb24a0a6935a26a3af1e8b0a","mode":"implement_and_merge_on_acceptance","planVersion":1,"recordedAt":"2026-08-31T10:49:30Z","repository":"github.com/KNaiFen/gkd","schemaVersion":1,"taskBranch":"task/gkd-i1-trusted-context-symlink-boundary","taskId":"GKD-I1-TRUSTED-CONTEXT-SYMLINK-BOUNDARY"}
