{"allowedActions":["ci_repair","commit","conditional_merge","pr_update","push","ready_for_review"],"authorizationDigest":"ded9e7a6827b5eb0ac8b9df99236258faa1e4a4af9a796ef4b0f831558803fe0","authorizationId":"39860d9c207fafbc32140d6ff70c826836c8952fd1e3e8ac374be24e6551f517","baseBranch":"main","baseSha":"bdfb493e7566fb936195352812bd0ae048f409a8","decisionRef":"user-authorization-2026-08-31-input-reduction","materialDigest":"51a1a9b8dce6a7e07fab72bfa9fde040393a6e346ba156ed25bb2a2ca0fe1261","mode":"implement_and_merge_on_acceptance","planVersion":2,"recordedAt":"2026-08-31T09:25:18Z","repository":"github.com/KNaiFen/gkd","schemaVersion":1,"taskBranch":"task/gkd-i1-trusted-task-context-r2","taskId":"GKD-I1-TRUSTED-TASK-CONTEXT-R2"}
