{"allowedActions":["ci_repair","commit","conditional_merge","pr_update","push","ready_for_review"],"authorizationDigest":"6ec76e4b2469c115471e56ea3a05c77216a6faf937dc7d404d274d449cf28982","authorizationId":"9b3df219f4a12d375bb0cfb2dec017cfcb4197a3b504d8b6905ace7cda21808f","baseBranch":"main","baseSha":"69cd40d0fa31b45ba3ce36e24eda2c42125fcd15","decisionRef":"decision-gkd-gate-repair","materialDigest":"3de3cdab4747c86f76f1f0252e0c6a5c9150dac6fb8f1d86fc87f6b0b2e484b9","mode":"implement_and_merge_on_acceptance","planVersion":1,"recordedAt":"2026-08-28T23:44:21Z","repository":"github.com/KNaiFen/gkd","schemaVersion":1,"taskBranch":"task/gkd-gate-repair","taskId":"GKD-GATE-REPAIR"}
