{"allowedActions":["ci_repair","commit","conditional_merge","pr_update","push","ready_for_review"],"authorizationDigest":"485cb0854f2f765da14daad1ea64afb14fdc8ae45e523e4d1072231e7b5178f9","authorizationId":"f61b2b239057cb03770c42e4bd1d05c9aa7365f05911214bc8032684d2757dbe","baseBranch":"main","baseSha":"f4bdab2ecad412dc42b6b85e8fc18c5162369d4c","decisionRef":"gkd-workflow-optimization-plan-2026-08-28.md/P0","materialDigest":"810fe713f6974785e33a56c0c7fe4a58ca4c6d9d495f3d0eb417b1ddb4319b5e","mode":"implement_and_merge_on_acceptance","planVersion":1,"recordedAt":"2026-08-29T17:03:26Z","repository":"github.com/KNaiFen/gkd","schemaVersion":1,"taskBranch":"task/gkd-python39-compatibility-r2","taskId":"GKD-PY39-COMPAT-R2"}
