{"allowedActions":["ci_repair","commit","conditional_merge","pr_update","push","ready_for_review"],"authorizationDigest":"37beeb49c6772cee50144b85106c2450cc65277677a365481da18b9aed0246ea","authorizationId":"50c6b49bf2a0886917ef427ec97dbc6bf8a7a9285f73b50348d8ab8a369cbb89","baseBranch":"main","baseSha":"ce2d6814a1a4b75e16fe9e096f66b399a28de07f","decisionRef":"gkd_core_implementation","materialDigest":"a2a71aa9658b35acea50d32d170667cf0c49b5059b9f794315206907cba76110","mode":"implement_and_merge_on_acceptance","planVersion":1,"recordedAt":"2026-08-30T19:38:12Z","repository":"github.com/KNaiFen/gkd","schemaVersion":1,"taskBranch":"task/gkd-o6-default-role-optional-pack-r2","taskId":"GKD-O6-DEFAULT-ROLE-OPTIONAL-PACK-R2"}
