{"allowedActions":["ci_repair","commit","conditional_merge","pr_update","push","ready_for_review"],"authorizationDigest":"b60ad0bb8c70f870fc018a43a5d0cc47275fd0509aeab9bd21e17df7028d7fea","authorizationId":"19ad2e291eb485f40ebe1f56bcee8eb67f240227b144ee1b4b12bffb340a03fb","baseBranch":"main","baseSha":"419549747fdf06918a5db9f31290bde37e598120","decisionRef":"gkd_core_implementation","materialDigest":"3e570e32ab370373aad435b4019b7113b355ced184b3d5c9d30b586362d0fde6","mode":"implement_and_merge_on_acceptance","planVersion":1,"recordedAt":"2026-08-30T12:18:17Z","repository":"github.com/KNaiFen/gkd","schemaVersion":1,"taskBranch":"task/gkd-o5-runtime-fixture-split-r2","taskId":"GKD-O5-RUNTIME-FIXTURE-SPLIT-R2"}
