{"allowedActions":["ci_repair","commit","conditional_merge","pr_update","push","ready_for_review"],"authorizationDigest":"6b249d63984107b39d69e7714d129f2124b892078e36f6fe60f508111af5065e","authorizationId":"5c86de04c6e6e25470bf86b07beea8007c959c15f3d2e7352d494430845ae828","baseBranch":"main","baseSha":"6b3f28aa8f1f1308fbb45064f5b96128837e4c4f","decisionRef":"frozen-plan-m3-c","materialDigest":"f90f3d2349f2885b1d5352f2120aa454c5ccbce98f979ba18dfc921878c29e4b","mode":"implement_and_merge_on_acceptance","planVersion":1,"recordedAt":"2026-08-21T18:33:37Z","repository":"github.com/KNaiFen/gkd","schemaVersion":1,"taskBranch":"task/m3-review-skills","taskId":"GKD-M3-C"}
