{"allowedActions":["ci_repair","commit","conditional_merge","pr_update","push","ready_for_review"],"authorizationDigest":"db611a39af7969d3185ad24ce42cd54c0515e2a27aa83cd2d841a374af70d13e","authorizationId":"5d1c905f36c1c65390707695ec01661ebe73397d97813cafd6772751919cf7b1","baseBranch":"main","baseSha":"97c97cec3aa9cf51973bf4436be4d1750e0436fc","decisionRef":"user/continuous-gkd-m3-m4-m5/2026-08-22/GKD-M3-B","materialDigest":"03c98722d85d5e505c42cb6ce16fe4d87b64b9c3bacaf642a7a7331f75217f67","mode":"implement_and_merge_on_acceptance","planVersion":1,"recordedAt":"2026-08-21T17:46:04Z","repository":"github.com/KNaiFen/gkd","schemaVersion":1,"taskBranch":"task/m3-resource-scanner","taskId":"GKD-M3-B"}
