{"allowedActions":["ci_repair","commit","conditional_merge","pr_update","push","ready_for_review"],"authorizationDigest":"3d12965168d25a79ac6795ace5a0215a6a1429f73150358d558e6bb6302e0c3f","authorizationId":"735906ef2267a6e687bdb053af326b323a70dd54e82d41413e3f31275de707d2","baseBranch":"main","baseSha":"c38e3a3d5a88b87beb13ff38fdefb82fa3416f6e","decisionRef":"gkd-r6-release-2026-08-23","materialDigest":"f35ddf690ed2c98560206becbe33d3a0c3e50ff6631846dd1875b214bb948981","mode":"implement_and_merge_on_acceptance","planVersion":1,"recordedAt":"2026-08-23T15:59:01Z","repository":"github.com/KNaiFen/gkd","schemaVersion":1,"taskBranch":"task/r6-runner-binding-release","taskId":"gkd-r6-runner-binding-release"}
