{"allowedActions":["ci_repair","commit","conditional_merge","pr_update","push","ready_for_review"],"authorizationDigest":"ed9ea4fcb771a703c08448537d4b56f359f4ec1b3bcf1caec59c430e8cc26f3b","authorizationId":"c353125f603032568825d05fb9f72b9ed22576b605dd05f2a1e1be7768c4d22d","baseBranch":"main","baseSha":"b5569bba8268770e2363372221bbc07dbdd6b92a","decisionRef":"gkd-workflow-optimization-plan-2026-08-28.md/GATE-REPAIR-R6","materialDigest":"390ef78d77ec3f835c2c57fdfaeabce639a4d26de69380e675d161ce5b60b526","mode":"implement_and_merge_on_acceptance","planVersion":1,"recordedAt":"2026-08-29T18:24:02Z","repository":"github.com/KNaiFen/gkd","schemaVersion":1,"taskBranch":"task/gkd-gate-repair-r6","taskId":"GKD-GATE-REPAIR-R6"}
