{"allowedActions":["ci_repair","commit","conditional_merge","pr_update","push","ready_for_review"],"authorizationDigest":"e4b83422f146c039b9a26374ce3f50e601d72d3d052ce63cd43f41db0393c61d","authorizationId":"5b6e236dc6cf7fe1b0eb7765be54dfc0904f1d32fafc657e0005301f5b215675","baseBranch":"main","baseSha":"4639a1bae97a56d293def0b5c2cf5d8406bfb217","decisionRef":"gkd-workflow-optimization-plan-2026-08-28-O1","materialDigest":"e074e86a811395bb8433203987640562b3354f783d3c0244b70d91203fad738e","mode":"implement_and_merge_on_acceptance","planVersion":1,"recordedAt":"2026-08-28T14:38:19Z","repository":"github.com/KNaiFen/gkd","schemaVersion":1,"taskBranch":"task/gkd-o1-core-cleanup","taskId":"GKD-O1"}
