{"allowedActions":["ci_repair","commit","conditional_merge","pr_update","push","ready_for_review"],"authorizationDigest":"f4395e3114afa8594df3173d19e98bf8d8aa290c222dbe20694942b60c546300","authorizationId":"6b58a110350077fba63a6230f0c9472e41b8d6743703ab5d4bc3d55e92e7db9c","baseBranch":"main","baseSha":"2d848db56aad86ece5daba281b7f857c6c1f82c6","decisionRef":"user-2026-08-23-continue-post-m2k-release-and-aio","materialDigest":"6326055e1023af30e02f46ca68f5b516790e7925cd2e9ff88429a3423bcd1945","mode":"implement_and_merge_on_acceptance","planVersion":1,"recordedAt":"2026-08-22T18:31:05Z","repository":"github.com/KNaiFen/gkd","schemaVersion":1,"taskBranch":"task/r1-versioned-release-upgrade","taskId":"GKD-R1"}
