{"allowedActions":["ci_repair","commit","conditional_merge","pr_update","push","ready_for_review"],"authorizationDigest":"c05b45236d613ab692f5fa5bb7019eb98170d6e447c07371877bcc173445c2a9","authorizationId":"73a2dc59a1b969e4669b404a7a04cfa274eaeaba99bd630b33a5e4e16bc5f27a","baseBranch":"main","baseSha":"fe5fae5ecd1500f65d5bad100dc66084f8d72472","decisionRef":"gkd_workflow_optimization_plan_o4","materialDigest":"afd95b50ec51cc069008a03a242ce36b2ac8540ca471aaa6f99a0cded677e8ae","mode":"implement_and_merge_on_acceptance","planVersion":1,"recordedAt":"2026-08-28T19:50:55Z","repository":"github.com/KNaiFen/gkd","schemaVersion":1,"taskBranch":"task/gkd-o4-watcher-historical-lane","taskId":"GKD-O4"}
