{"allowedActions":["ci_repair","commit","conditional_merge","pr_update","push","ready_for_review"],"authorizationDigest":"90e07a52c238aadb29a474bd1fb3688b75450a9953a92031e5dbac4612e1cad6","authorizationId":"9ee41d2e45af7084fb565270d2c9995f0b660c14e4c77203373877aacde96c7d","baseBranch":"main","baseSha":"6b5d5b78a3c5f5cc98d0659167b5d3838d14f518","decisionRef":"user/continuous-gkd-m3-m4-m5/2026-08-21/GKD-M2-J","materialDigest":"6eade40c36b65e74df4a904509a2f7676ce2d3db3309fb3ad69988de0a4e20c8","mode":"implement_and_merge_on_acceptance","planVersion":1,"recordedAt":"2026-08-20T18:30:55Z","repository":"github.com/KNaiFen/gkd","schemaVersion":1,"taskBranch":"task/m2-delivery-document-contract","taskId":"GKD-M2-J"}
