{"allowedActions":["ci_repair","commit","conditional_merge","pr_update","push","ready_for_review"],"authorizationDigest":"d42a3d028f2f3a4424571676fa23b1ba9b892dab7f88cd7893eafc26df038d42","authorizationId":"a3dd2b55f3284646ccb59781562ecf9ffa85a5df8ad56a61841a633b0ce4137b","baseBranch":"main","baseSha":"a1dad775ee9d652203ab18efb1378362772dcc4a","decisionRef":"frozen-plan-m4-a","materialDigest":"a41a0f8b8b7d07fc45f87afabd71ca30182f0f2c0d01094c6b05c11bc75e03d9","mode":"implement_and_merge_on_acceptance","planVersion":1,"recordedAt":"2026-08-21T19:19:53Z","repository":"github.com/KNaiFen/gkd","schemaVersion":1,"taskBranch":"task/m4-finalization-release","taskId":"GKD-M4-A"}
