{"allowedActions":["ci_repair","commit","conditional_merge","pr_update","push","ready_for_review"],"authorizationDigest":"32017c6889bb0a55e2e676145df6ee09b4dd2fbca2749b0aa05f65148b2d8163","authorizationId":"649a7591e3615927c8d15579d3a558010c90b421787fb7d4d1a85592e8f9dec1","baseBranch":"main","baseSha":"6b5d5b78a3c5f5cc98d0659167b5d3838d14f518","decisionRef":"user/continuous-gkd-m3-m4-m5/2026-08-20/GKD-M2-E","materialDigest":"6f1b66dcc908e8d029534b749ac45a91a115cdb88b658d50926bb5493d8d4bd1","mode":"implement_and_merge_on_acceptance","planVersion":1,"recordedAt":"2026-08-20T14:47:41Z","repository":"github.com/KNaiFen/gkd","schemaVersion":1,"taskBranch":"task/m2-epoch-aware-spawn-name","taskId":"GKD-M2-E"}
